{
  "run_id": "20261010-194738-referencia-holdout",
  "started_at": "2026-10-10T19:47:38-03:00",
  "finished_at": "2026-10-10T19:50:05-03:00",
  "status": "complete",
  "subset": "holdout",
  "gabarito_version": "2026-10-10.1",
  "gabarito_hash": "fa3c8201a3bafc4e5e6903b277f8563423b389f11bc35d23b19e5cdcbb089e1d",
  "config": {
    "chunk_size": 500,
    "chunk_overlap": 200,
    "vector_k": 3,
    "bm25_k": 3,
    "chat_model": "llama3",
    "embedding_model": "nomic-embed-text",
    "temperature": 0,
    "seed": 42,
    "num_ctx": null,
    "prompt_hash": "bcd20ffa2c1fda83",
    "kb_hash": "155be1220c95d900",
    "kb_chunk_count": 11,
    "judge_model": "llama3",
    "git_commit": "e49a7bb",
    "git_dirty": true
  },
  "repeat": 1,
  "results": [
    {
      "item_id": "limpeza-resultado-01",
      "answer": "A limpeza dental é um procedimento que dura entre 30 a 50 minutos. Você sentirá a sensação imediata de boca limpa e hálito mais fresco após a primeira sessão.",
      "retrieved": {
        "vector": [
          {
            "content": "OdontoTest – Transforme Seu Sorriso com\nSegurança, Rapidez e Resultado Garantido\nNa OdontoTest, cada tratamento é planejado para entregar resultado visível, conforto durante o\nprocesso e máxima durabilidade. Você não está apenas fazendo um procedimento — está\ninvestindo em autoestima, saúde e confiança no seu dia a dia.\nLimpeza Dental – O Primeiro Passo Para um Sorriso Saudável\nO que você ganha:\n\nSensação imediata de boca limpa\n\nHálito mais fresco\n",
            "rank": 1,
            "score": 0.5827959330233919
          },
          {
            "content": "investindo em autoestima, saúde e confiança no seu dia a dia.\nLimpeza Dental – O Primeiro Passo Para um Sorriso Saudável\nO que você ganha:\n\nSensação imediata de boca limpa\n\nHálito mais fresco\n\nPrevenção de problemas maiores (economiza dinheiro no futuro)\nComo é feito: Remoção de placa e tártaro com ultrassom + polimento.\nTempo: 30 a 50 minutos\nInvestimento: R$ 120 a R$ 250\nResultado: Imediato já na primeira sessão\nClareamento Dental – Dentes Brancos em Poucos Dias\nIdeal para quem quer:\n",
            "rank": 2,
            "score": 0.5790724275448484
          },
          {
            "content": "Tempo: 2 a 3 consultas\nInvestimento: R$ 1.500 a R$ 3.500 por dente\nResultado: Sorriso perfeito com durabilidade até 15 anos\nPor Que Escolher a OdontoTest?\n\nAtendimento rápido (até 72h)\n\nProcedimentos no mesmo dia quando possível\n\nTecnologia moderna e menos dor\n\nPlanejamento com previsibilidade\n\nFacilidade de pagamento\nAgende Agora Sua Avaliação\nQuanto mais você espera, maior pode ser o problema — e o custo. Na OdontoTest, você resolve",
            "rank": 3,
            "score": 0.5293424759030259
          }
        ],
        "bm25": [
          {
            "content": "OdontoTest – Transforme Seu Sorriso com\nSegurança, Rapidez e Resultado Garantido\nNa OdontoTest, cada tratamento é planejado para entregar resultado visível, conforto durante o\nprocesso e máxima durabilidade. Você não está apenas fazendo um procedimento — está\ninvestindo em autoestima, saúde e confiança no seu dia a dia.\nLimpeza Dental – O Primeiro Passo Para um Sorriso Saudável\nO que você ganha:\n\nSensação imediata de boca limpa\n\nHálito mais fresco\n",
            "rank": 1,
            "score": 2.8168433832357818
          },
          {
            "content": "Recuperação: 3 a 7 dias\nResultado: Alívio da dor e prevenção de complicações\nLentes de Contato Dental – O Sorriso Perfeito em Poucos Dias\nIdeal para quem quer:\n\nSorriso de artista\n\nCorrigir formato, cor e alinhamento\n\nResultado imediato e impactante\nComo funciona: Lâminas de porcelana ultrafinas aplicadas sobre os dentes.\nTempo: 2 a 3 consultas\nInvestimento: R$ 1.500 a R$ 3.500 por dente\nResultado: Sorriso perfeito com durabilidade até 15 anos\nPor Que Escolher a OdontoTest?\n",
            "rank": 2,
            "score": 2.4374149635573557
          },
          {
            "content": "\nPlanejamento com previsibilidade\n\nFacilidade de pagamento\nAgende Agora Sua Avaliação\nQuanto mais você espera, maior pode ser o problema — e o custo. Na OdontoTest, você resolve\ndesde o básico até tratamentos completos com segurança e previsibilidade.",
            "rank": 3,
            "score": 2.331654968754845
          }
        ],
        "fused": [
          {
            "content": "OdontoTest – Transforme Seu Sorriso com\nSegurança, Rapidez e Resultado Garantido\nNa OdontoTest, cada tratamento é planejado para entregar resultado visível, conforto durante o\nprocesso e máxima durabilidade. Você não está apenas fazendo um procedimento — está\ninvestindo em autoestima, saúde e confiança no seu dia a dia.\nLimpeza Dental – O Primeiro Passo Para um Sorriso Saudável\nO que você ganha:\n\nSensação imediata de boca limpa\n\nHálito mais fresco\n",
            "rank": 1,
            "score": null
          },
          {
            "content": "investindo em autoestima, saúde e confiança no seu dia a dia.\nLimpeza Dental – O Primeiro Passo Para um Sorriso Saudável\nO que você ganha:\n\nSensação imediata de boca limpa\n\nHálito mais fresco\n\nPrevenção de problemas maiores (economiza dinheiro no futuro)\nComo é feito: Remoção de placa e tártaro com ultrassom + polimento.\nTempo: 30 a 50 minutos\nInvestimento: R$ 120 a R$ 250\nResultado: Imediato já na primeira sessão\nClareamento Dental – Dentes Brancos em Poucos Dias\nIdeal para quem quer:\n",
            "rank": 2,
            "score": null
          },
          {
            "content": "Tempo: 2 a 3 consultas\nInvestimento: R$ 1.500 a R$ 3.500 por dente\nResultado: Sorriso perfeito com durabilidade até 15 anos\nPor Que Escolher a OdontoTest?\n\nAtendimento rápido (até 72h)\n\nProcedimentos no mesmo dia quando possível\n\nTecnologia moderna e menos dor\n\nPlanejamento com previsibilidade\n\nFacilidade de pagamento\nAgende Agora Sua Avaliação\nQuanto mais você espera, maior pode ser o problema — e o custo. Na OdontoTest, você resolve",
            "rank": 3,
            "score": null
          },
          {
            "content": "Recuperação: 3 a 7 dias\nResultado: Alívio da dor e prevenção de complicações\nLentes de Contato Dental – O Sorriso Perfeito em Poucos Dias\nIdeal para quem quer:\n\nSorriso de artista\n\nCorrigir formato, cor e alinhamento\n\nResultado imediato e impactante\nComo funciona: Lâminas de porcelana ultrafinas aplicadas sobre os dentes.\nTempo: 2 a 3 consultas\nInvestimento: R$ 1.500 a R$ 3.500 por dente\nResultado: Sorriso perfeito com durabilidade até 15 anos\nPor Que Escolher a OdontoTest?\n",
            "rank": 4,
            "score": null
          },
          {
            "content": "\nPlanejamento com previsibilidade\n\nFacilidade de pagamento\nAgende Agora Sua Avaliação\nQuanto mais você espera, maior pode ser o problema — e o custo. Na OdontoTest, você resolve\ndesde o básico até tratamentos completos com segurança e previsibilidade.",
            "rank": 5,
            "score": null
          }
        ]
      },
      "retrieval": {
        "vector": {
          "hit": true,
          "recall": 1.0,
          "mrr": 0.5,
          "context_precision": 0.3333333333333333,
          "anchored": true
        },
        "bm25": {
          "hit": false,
          "recall": 0.0,
          "mrr": 0.0,
          "context_precision": 0.0,
          "anchored": false
        },
        "fused": {
          "hit": true,
          "recall": 1.0,
          "mrr": 0.5,
          "context_precision": 0.2,
          "anchored": true
        }
      },
      "facts": [
        {
          "label": "resultado imediato",
          "found": true
        }
      ],
      "unexpected_values": [],
      "ungrounded_values": [],
      "abstained": false,
      "rule_violations": [],
      "judge": {
        "relevance": {
          "verdict": true,
          "reason": "A resposta trata do tempo necessário para a limpeza, que é o que o cliente perguntou."
        },
        "tone": {
          "verdict": false,
          "reason": "A resposta é cordial e profissional, mas apresenta um tom um pouco mais formal do que o esperado para um atendente de clínica."
        },
        "scheduling": {
          "verdict": false,
          "reason": "A resposta não convida explicitamente o cliente a agendar uma consulta ou avaliação."
        },
        "conciseness": {
          "verdict": false,
          "reason": "A resposta lista informações adicionais e não é direta ao ponto, não entregando a informação solicitada."
        },
        "faithfulness": {
          "verdict": true,
          "reason": "A resposta afirma que a limpeza dental dura entre 30 a 50 minutos e que o resultado é imediato após a primeira sessão, o que está nos trechos disponíveis."
        }
      },
      "latency_s": 2.028,
      "passed": true,
      "cause": null,
      "flags": []
    },
    {
      "item_id": "clareamento-resultado-01",
      "answer": "O resultado do clareamento é imediato, você pode notar a diferença já na primeira sessão!",
      "retrieved": {
        "vector": [
          {
            "content": "Tempo: 30 a 50 minutos\nInvestimento: R$ 120 a R$ 250\nResultado: Imediato já na primeira sessão\nClareamento Dental – Dentes Brancos em Poucos Dias\nIdeal para quem quer:\n\nMelhorar a aparência rapidamente\n\nRemover manchas de café, vinho ou cigarro\n\nTer mais confiança ao sorrir\nComo funciona: Gel clareador profissional com aplicação em consultório ou uso caseiro\nsupervisionado.\nTempo: Consultório: no mesmo dia | Completo: até 14 dias\nInvestimento: R$ 500 a R$ 1.500",
            "rank": 1,
            "score": 0.5903002215476052
          },
          {